{
  "schema_version": 2,
  "name": "undersized_resources",
  "domain_id": 95,
  "node": {
    "name": "undersized_resources",
    "namespace": ""
  },
  "rmw": ["rmw_cyclonedds_c"],
  "message_profile": "fixed_size",
  "graph": {
    "outbound": false,
    "inbound": false,
    "api": []
  },
  "resources": {
    "local_endpoints": 1,
    "remote": {
      "participants": 0,
      "nodes": 0,
      "endpoints": 0
    },
    "workers": {
      "maximum": 5
    },
    "application": {
      "static_reserve_bytes": 0
    },
    "targets": {
      "native_sim/native/64": {
        "flash_bytes": 1000000,
        "ram_bytes": 1500000
      }
    }
  },
  "endpoints": [
    {
      "id": "outgoing",
      "kind": "publisher",
      "topic": "undersized/outgoing",
      "type": "ros2_zephyr_test_msgs/msg/NestedFixed",
      "qos": {
        "reliability": "best_effort",
        "durability": "volatile",
        "history": "keep_last",
        "depth": 1
      },
      "lifetime": "fixed_startup"
    },
    {
      "id": "incoming",
      "kind": "subscription",
      "topic": "undersized/incoming",
      "type": "ros2_zephyr_test_msgs/msg/NestedFixed",
      "callback": "subscription_callback",
      "qos": {
        "reliability": "best_effort",
        "durability": "volatile",
        "history": "keep_last",
        "depth": 1
      },
      "lifetime": "fixed_startup"
    }
  ]
}
